<?xml version="1.0" encoding="UTF-8"?>
<solicitud xmlns:xsi="http://www.w3.org/2001/XMLSchema-instance" xsi:noNamespaceSchemaLocation="solicitud.xsd">
<!--<!DOCTYPE solicitud SYSTEM "solicitud.dtd">-->
<!--<solicitud>-->
	<solicitante>
		<nombre>Alberto Rodr√≠guez Alonso</nombre>
		<anio>2023</anio>
		<direccion>
			<calle>Avda. Reconquista</calle>
			<numero>12</numero>
			<piso>1</piso>
			<letra>D</letra>
		</direccion>
		<telefono>698227182</telefono>
		<telefono>925265789</telefono>
	</solicitante>
	<actividad>
		<nombre>Natacion</nombre>
		<nivel>3</nivel>
	</actividad>
	<peticion>C02</peticion>
	<peticion>D03</peticion>
	<peticion>A10</peticion>
</solicitud>
